{
  "version": 1,
  "pages": [
    "casa-v1-0.png"
  ],
  "page_sizes": [
    [
      512,
      256
    ]
  ],
  "padding": 2,
  "extrude": 1,
  "frames": {
    "casa-v1/floor/carpet": {
      "page": 0,
      "x": 185,
      "y": 160,
      "w": 64,
      "h": 32,
      "pivot": [
        32,
        31
      ],
      "z_base": 0
    },
    "casa-v1/floor/cobble": {
      "page": 0,
      "x": 69,
      "y": 174,
      "w": 64,
      "h": 32,
      "pivot": [
        32,
        31
      ],
      "z_base": 0
    },
    "casa-v1/floor/moss": {
      "page": 0,
      "x": 1,
      "y": 177,
      "w": 64,
      "h": 32,
      "pivot": [
        32,
        31
      ],
      "z_base": 0
    },
    "casa-v1/floor/tile": {
      "page": 0,
      "x": 137,
      "y": 196,
      "w": 64,
      "h": 32,
      "pivot": [
        32,
        31
      ],
      "z_base": 0
    },
    "casa-v1/floor/walnut": {
      "page": 0,
      "x": 205,
      "y": 196,
      "w": 64,
      "h": 32,
      "pivot": [
        32,
        31
      ],
      "z_base": 0
    },
    "casa-v1/floor/wood": {
      "page": 0,
      "x": 273,
      "y": 209,
      "w": 64,
      "h": 32,
      "pivot": [
        32,
        31
      ],
      "z_base": 0
    },
    "casa-v1/object/bed": {
      "page": 0,
      "x": 1,
      "y": 1,
      "w": 112,
      "h": 104,
      "pivot": [
        56,
        103
      ],
      "z_base": 0
    },
    "casa-v1/object/bookshelf": {
      "page": 0,
      "x": 163,
      "y": 1,
      "w": 56,
      "h": 94,
      "pivot": [
        28,
        93
      ],
      "z_base": 0
    },
    "casa-v1/object/chair": {
      "page": 0,
      "x": 69,
      "y": 109,
      "w": 38,
      "h": 59,
      "pivot": [
        19,
        58
      ],
      "z_base": 0
    },
    "casa-v1/object/chest": {
      "page": 0,
      "x": 431,
      "y": 146,
      "w": 52,
      "h": 60,
      "pivot": [
        26,
        59
      ],
      "z_base": 0
    },
    "casa-v1/object/door": {
      "page": 0,
      "x": 117,
      "y": 1,
      "w": 42,
      "h": 101,
      "pivot": [
        21,
        100
      ],
      "z_base": 0
    },
    "casa-v1/object/lamp": {
      "page": 0,
      "x": 273,
      "y": 1,
      "w": 30,
      "h": 81,
      "pivot": [
        15,
        80
      ],
      "z_base": 0
    },
    "casa-v1/object/plant": {
      "page": 0,
      "x": 391,
      "y": 1,
      "w": 44,
      "h": 71,
      "pivot": [
        22,
        70
      ],
      "z_base": 0
    },
    "casa-v1/object/rug": {
      "page": 0,
      "x": 391,
      "y": 76,
      "w": 110,
      "h": 66,
      "pivot": [
        55,
        65
      ],
      "z_base": 0
    },
    "casa-v1/object/table": {
      "page": 0,
      "x": 291,
      "y": 149,
      "w": 62,
      "h": 56,
      "pivot": [
        31,
        55
      ],
      "z_base": 0
    },
    "casa-v1/object/tv": {
      "page": 0,
      "x": 307,
      "y": 79,
      "w": 52,
      "h": 66,
      "pivot": [
        26,
        65
      ],
      "z_base": 0
    },
    "casa-v1/object/window": {
      "page": 0,
      "x": 223,
      "y": 1,
      "w": 46,
      "h": 87,
      "pivot": [
        23,
        86
      ],
      "z_base": 0
    },
    "casa-v1/object/workbench": {
      "page": 0,
      "x": 307,
      "y": 1,
      "w": 80,
      "h": 74,
      "pivot": [
        40,
        73
      ],
      "z_base": 0
    },
    "casa-v1/wall/brick": {
      "page": 0,
      "x": 223,
      "y": 92,
      "w": 64,
      "h": 64,
      "pivot": [
        32,
        63
      ],
      "z_base": 0
    },
    "casa-v1/wall/panel": {
      "page": 0,
      "x": 117,
      "y": 106,
      "w": 64,
      "h": 64,
      "pivot": [
        32,
        63
      ],
      "z_base": 0
    },
    "casa-v1/wall/plaster": {
      "page": 0,
      "x": 1,
      "y": 109,
      "w": 64,
      "h": 64,
      "pivot": [
        32,
        63
      ],
      "z_base": 0
    },
    "casa-v1/wall/wallpaper": {
      "page": 0,
      "x": 363,
      "y": 146,
      "w": 64,
      "h": 64,
      "pivot": [
        32,
        63
      ],
      "z_base": 0
    }
  },
  "tiles": {
    "floor/carpet": {
      "frame": "casa-v1/floor/carpet",
      "height": 0,
      "occludes": false,
      "footprint": [
        1,
        1
      ],
      "walkable": true
    },
    "floor/cobble": {
      "frame": "casa-v1/floor/cobble",
      "height": 0,
      "occludes": false,
      "footprint": [
        1,
        1
      ],
      "walkable": true
    },
    "floor/moss": {
      "frame": "casa-v1/floor/moss",
      "height": 0,
      "occludes": false,
      "footprint": [
        1,
        1
      ],
      "walkable": true
    },
    "floor/tile": {
      "frame": "casa-v1/floor/tile",
      "height": 0,
      "occludes": false,
      "footprint": [
        1,
        1
      ],
      "walkable": true
    },
    "floor/walnut": {
      "frame": "casa-v1/floor/walnut",
      "height": 0,
      "occludes": false,
      "footprint": [
        1,
        1
      ],
      "walkable": true
    },
    "floor/wood": {
      "frame": "casa-v1/floor/wood",
      "height": 0,
      "occludes": false,
      "footprint": [
        1,
        1
      ],
      "walkable": true
    },
    "object/bed": {
      "frame": "casa-v1/object/bed",
      "height": 16,
      "occludes": false,
      "footprint": [
        2,
        2
      ],
      "walkable": false
    },
    "object/bookshelf": {
      "frame": "casa-v1/object/bookshelf",
      "height": 32,
      "occludes": true,
      "footprint": [
        1,
        1
      ],
      "walkable": false
    },
    "object/chair": {
      "frame": "casa-v1/object/chair",
      "height": 16,
      "occludes": false,
      "footprint": [
        1,
        1
      ],
      "walkable": false
    },
    "object/chest": {
      "frame": "casa-v1/object/chest",
      "height": 14,
      "occludes": false,
      "footprint": [
        1,
        1
      ],
      "walkable": false
    },
    "object/door": {
      "frame": "casa-v1/object/door",
      "height": 32,
      "occludes": false,
      "footprint": [
        1,
        1
      ],
      "walkable": true
    },
    "object/lamp": {
      "frame": "casa-v1/object/lamp",
      "height": 28,
      "occludes": false,
      "footprint": [
        1,
        1
      ],
      "walkable": false
    },
    "object/plant": {
      "frame": "casa-v1/object/plant",
      "height": 20,
      "occludes": false,
      "footprint": [
        1,
        1
      ],
      "walkable": false
    },
    "object/rug": {
      "frame": "casa-v1/object/rug",
      "height": 0,
      "occludes": false,
      "footprint": [
        2,
        2
      ],
      "walkable": true
    },
    "object/table": {
      "frame": "casa-v1/object/table",
      "height": 16,
      "occludes": false,
      "footprint": [
        1,
        1
      ],
      "walkable": false
    },
    "object/tv": {
      "frame": "casa-v1/object/tv",
      "height": 20,
      "occludes": false,
      "footprint": [
        1,
        1
      ],
      "walkable": false
    },
    "object/window": {
      "frame": "casa-v1/object/window",
      "height": 32,
      "occludes": false,
      "footprint": [
        1,
        1
      ],
      "walkable": false
    },
    "object/workbench": {
      "frame": "casa-v1/object/workbench",
      "height": 20,
      "occludes": false,
      "footprint": [
        2,
        1
      ],
      "walkable": false
    },
    "wall/brick": {
      "frame": "casa-v1/wall/brick",
      "height": 32,
      "occludes": true,
      "footprint": [
        1,
        1
      ],
      "walkable": false
    },
    "wall/panel": {
      "frame": "casa-v1/wall/panel",
      "height": 32,
      "occludes": true,
      "footprint": [
        1,
        1
      ],
      "walkable": false
    },
    "wall/plaster": {
      "frame": "casa-v1/wall/plaster",
      "height": 32,
      "occludes": true,
      "footprint": [
        1,
        1
      ],
      "walkable": false
    },
    "wall/wallpaper": {
      "frame": "casa-v1/wall/wallpaper",
      "height": 32,
      "occludes": true,
      "footprint": [
        1,
        1
      ],
      "walkable": false
    }
  }
}
